{
  "lastUpdated": "2026-07-21",
  "source": "Population and barangay count: Philippine Statistics Authority, Philippine Standard Geographic Code city profile for Alaminos City (population as of the 2024 Census; barangay count as of July 31, 2025). Poverty incidence: Philippine Statistics Authority, 2021 City and Municipal Level Poverty Estimates. Land area: PhilAtlas.com. Registered businesses: City Government of Alaminos, Business Permit and Licensing Section, List of Business Establishments by Barangay (as of April 26, 2022).",
  "totalPopulation": 100430,
  "barangays": [
    { "name": "Alos", "population": 1974 },
    { "name": "Amandiego", "population": 1640 },
    { "name": "Amangbangan", "population": 1298 },
    { "name": "Balangobong", "population": 2000 },
    { "name": "Balayang", "population": 1483 },
    { "name": "Bisocol", "population": 1617 },
    { "name": "Bolaney", "population": 2746 },
    { "name": "Baleyadaan", "population": 1895 },
    { "name": "Bued", "population": 3887 },
    { "name": "Cabatuan", "population": 1679 },
    { "name": "Cayucay", "population": 1862 },
    { "name": "Dulacac", "population": 1387 },
    { "name": "Inerangan", "population": 1727 },
    { "name": "Linmansangan", "population": 1192 },
    { "name": "Lucap", "population": 6606 },
    { "name": "Macatiw", "population": 1055 },
    { "name": "Magsaysay", "population": 4271 },
    { "name": "Mona", "population": 2090 },
    { "name": "Palamis", "population": 4912 },
    { "name": "Pangapisan", "population": 3561 },
    { "name": "Poblacion", "population": 11077 },
    { "name": "Pocalpocal", "population": 2976 },
    { "name": "Pogo", "population": 2597 },
    { "name": "Polo", "population": 2572 },
    { "name": "Quibuar", "population": 1738 },
    { "name": "Sabangan", "population": 2093 },
    { "name": "San Jose", "population": 2036 },
    { "name": "San Roque", "population": 2252 },
    { "name": "San Vicente", "population": 4675 },
    { "name": "Santa Maria", "population": 1471 },
    { "name": "Tanaytay", "population": 1918 },
    { "name": "Tangcarang", "population": 2653 },
    { "name": "Tawintawin", "population": 1749 },
    { "name": "Telbang", "population": 3965 },
    { "name": "Victoria", "population": 2415 },
    { "name": "Landoc", "population": 747 },
    { "name": "Maawi", "population": 1430 },
    { "name": "Pandan", "population": 1852 },
    { "name": "San Antonio", "population": 1332 }
  ],
  "economicIndicators": [
    { "label": "Poverty Incidence", "value": "17.5% (2021)" },
    { "label": "Land Area", "value": "164.26 km²" },
    { "label": "Registered Businesses", "value": "2,925 (2022)" }
  ]
}
